"Name","Link","Tags","Story Points","Status","Assignees","Wallet Address","Reward","Due Date","Activities"
"WIP Screenshots","https://app.dework.xyz/m3/milestones-19868?taskId=04f457cd-ea53-4f8b-93fc-1ef1707f86f4","","","IN_PROGRESS","boomboxhead","0x670A6EB62f5146d4B3B40C7b58AA31d175E3d6Fb","","","boomboxhead created on May 16, 2024 1:30 AM"
"add meta-loot","https://app.dework.xyz/m3/milestones-19868?taskId=9c324a91-a05e-445a-a994-16f1f2ca587c","","","TODO","","","","","boomboxhead created on May 16, 2024 1:28 AM"
"sanitize and rename the filenames, special chars for assets","https://app.dework.xyz/m3/milestones-19868?taskId=62d57399-75fb-4387-9f5f-997603ba8d78","","","IN_PROGRESS","boomboxhead","0x670A6EB62f5146d4B3B40C7b58AA31d175E3d6Fb","","","boomboxhead created on May 16, 2024 1:26 AM"
"Animation Baking Starting Point","https://app.dework.xyz/m3/milestones-19868?taskId=0a545666-98c4-411c-bf86-6940a7a0f353","","","TODO","","","","","boomboxhead created on May 16, 2024 1:25 AM"
"Generate HTML per generation","https://app.dework.xyz/m3/milestones-19868?taskId=9713fe79-585e-4f82-a3da-c5e88331b41e","","","TODO","","","","","boomboxhead created on May 16, 2024 1:24 AM"
"Refactor JSON batch import script from Anatas project","https://app.dework.xyz/m3/milestones-19868?taskId=a7689cd5-175a-478f-b5d9-4aa21bef6784","","","TODO","","","","","boomboxhead created on May 16, 2024 1:23 AM"
"Cant use gifs in GLB","https://app.dework.xyz/m3/milestones-19868?taskId=535c2eba-6109-44f8-91b7-d0e8415dcfc4","","","TODO","","","","","boomboxhead created on May 16, 2024 1:22 AM"
"test animation export, and how to deal with animator / glb export","https://app.dework.xyz/m3/milestones-19868?taskId=4b3f1214-e1bf-4d59-ba35-8e2d1cc23b29","","","TODO","","","","","boomboxhead created on May 16, 2024 1:21 AM"
"rebake lighting in blender with a batch script after generation along with optimizations","https://app.dework.xyz/m3/milestones-19868?taskId=ccaf44e4-f613-48e2-8af4-e73ce3f57893","","","TODO","","","","","boomboxhead created on May 16, 2024 1:20 AM"
"re-factor and port over memes Options Managers and Helper Scripts","https://app.dework.xyz/m3/milestones-19868?taskId=613ebf58-5bc7-4bf0-990c-8fed5a57aa45","","","TODO","","","","","boomboxhead created on May 16, 2024 1:20 AM"
"address duplicates in randommizer...","https://app.dework.xyz/m3/milestones-19868?taskId=54b41c0c-efa7-4af6-beb3-09c7a776a36d","","","TODO","","","","","boomboxhead created on May 16, 2024 1:19 AM"
"NFTs need to be shuffled on mint","https://app.dework.xyz/m3/milestones-19868?taskId=7384c06a-9a08-4ee7-9cb2-7426e8771c00","","","TODO","","","","","boomboxhead created on May 16, 2024 1:18 AM"
"randomize camera positions","https://app.dework.xyz/m3/milestones-19868?taskId=7eabbde8-c980-4587-b029-484bf03049ba","","","TODO","","","","","boomboxhead created on May 16, 2024 1:05 AM"
"Add metadata to Jins slides","https://app.dework.xyz/m3/milestones-19868?taskId=a991447f-8734-46f2-8629-afc9b296e551","","","TODO","","","","","boomboxhead created on May 16, 2024 1:03 AM"
"Project Website","https://app.dework.xyz/m3/milestones-19868?taskId=fd89d676-e342-4780-974d-ac01c0f22ecf","","","IN_PROGRESS","boomboxhead","0x670A6EB62f5146d4B3B40C7b58AA31d175E3d6Fb","","","boomboxhead created on May 16, 2024 1:02 AM"
"Milestones Event To Gather Media / Assets","https://app.dework.xyz/m3/milestones-19868?taskId=396a4f5e-ad56-44ec-81e7-23c7c3db2f6d","","","TODO","","","","","boomboxhead created on May 16, 2024 1:00 AM"
"Aspect Ratio Code For Jins Notes","https://app.dework.xyz/m3/milestones-19868?taskId=30b9b768-e365-48ac-85a9-5508c39fa0bf","","","DONE","","","","","boomboxhead created on May 16, 2024 12:56 AM, Task completed on May 16, 2024 12:56 AM"
"Milestones Issues From Github","https://app.dework.xyz/m3/milestones-19868?taskId=b616c8c7-d240-45ce-8bd1-88252a982ac1","","","IN_PROGRESS","boomboxhead","0x670A6EB62f5146d4B3B40C7b58AA31d175E3d6Fb","","","boomboxhead created on May 16, 2024 12:55 AM"
"Possible Assets","https://app.dework.xyz/m3/milestones-19868?taskId=5e305a87-73ca-417a-b40e-bfe86515b254","","","IN_PROGRESS","boomboxhead","0x670A6EB62f5146d4B3B40C7b58AA31d175E3d6Fb","","","boomboxhead created on May 16, 2024 12:54 AM"
"Schedule an event (Demo Day)","https://app.dework.xyz/m3/milestones-19868?taskId=671249fa-27ec-4f38-86a7-376b46a45400","","","TODO","","","","","boomboxhead created on May 16, 2024 12:52 AM"
"Create blog post","https://app.dework.xyz/m3/milestones-19868?taskId=089147dd-494e-4b6f-ac3f-4fa13827bac5","","","TODO","","","","","boomboxhead created on May 16, 2024 12:52 AM"
"Create promo video","https://app.dework.xyz/m3/milestones-19868?taskId=e857af02-6166-4338-b48f-f2bb8ce072f7","","","TODO","","","","","boomboxhead created on May 16, 2024 12:52 AM"
"Go over drop dynamics, network, and decide hosting solutions","https://app.dework.xyz/m3/milestones-19868?taskId=4aa5bdf2-35e6-46ed-a723-53368a340ea5","","","TODO","","","","","boomboxhead created on May 16, 2024 12:52 AM"
"Conduct quality assurance checks on assembled assets","https://app.dework.xyz/m3/milestones-19868?taskId=41ba2e93-b63f-4c0b-8c8e-02f86d30d7db","","","TODO","","","","","boomboxhead created on May 16, 2024 12:51 AM"
"Create new shipping container that is licensable","https://app.dework.xyz/m3/milestones-19868?taskId=152ab6ea-e2ba-4ff8-b0ec-0312b4340989","","","TODO","","","","","boomboxhead created on May 16, 2024 12:51 AM"
"Refactor boom-tools batch randomizer for asset assembly","https://app.dework.xyz/m3/milestones-19868?taskId=8d6f6359-0563-469d-afd2-d27f52786851","","","DONE","boomboxhead","0x670A6EB62f5146d4B3B40C7b58AA31d175E3d6Fb","","","boomboxhead created on May 16, 2024 12:51 AM, Task completed on May 16, 2024 12:51 AM"
"Port boom-tools to work with objects and export glbs","https://app.dework.xyz/m3/milestones-19868?taskId=ff29b420-0ad2-4b7a-95f2-ce8b38d595b6","","","DONE","boomboxhead","0x670A6EB62f5146d4B3B40C7b58AA31d175E3d6Fb","","","boomboxhead created on May 16, 2024 12:50 AM, Task completed on May 16, 2024 12:50 AM"
"Projects to Get Assets For","https://app.dework.xyz/m3/milestones-19868?taskId=f9bce962-843f-474f-95d2-bccdf4365b9d","","","IN_PROGRESS","boomboxhead","0x670A6EB62f5146d4B3B40C7b58AA31d175E3d6Fb","","","boomboxhead created on May 16, 2024 12:49 AM"
"Milestones Production","https://app.dework.xyz/m3/milestones-19868?taskId=cb98767c-b312-4960-9947-c62aef43a9da","","100","DONE","boomboxhead","0x670A6EB62f5146d4B3B40C7b58AA31d175E3d6Fb","0.54 WETH","","boomboxhead created on Apr 3, 2024 7:11 PM, Task completed on May 25, 2024 7:37 PM"
"test task","https://app.dework.xyz/m3/milestones-19868?taskId=e414ca91-0557-4f5c-8d2e-7c36e5cd5e22","good first issue","1","DONE","boomboxhead","0x670A6EB62f5146d4B3B40C7b58AA31d175E3d6Fb","","","boomboxhead created on Apr 3, 2024 2:39 PM, Task completed on Apr 3, 2024 7:13 PM"